{
  "$schema": "http://json-schema.org/draft-07/schema#",
  "$id": "apd.json",
  "type": "object",
  "required": [
    "name",
    "activities",
    "federalCitations",
    "incentivePayments",
    "keyPersonnel",
    "narrativeHIE",
    "narrativeHIT",
    "narrativeMMIS",
    "previousActivityExpenses",
    "previousActivitySummary",
    "programOverview",
    "stateProfile",
    "years"
  ],
  "properties": {
    "_id": { "type": "string" },
    "name": { "type": "string" },
    "createdAt": { "$ref": "definitions.json#/definitions/optionalFullDate" },
    "updatedAt": { "$ref": "definitions.json#/definitions/optionalFullDate" },
    "stateId": { "type": "string" },
    "status": { "type": "string" },
    "__v": { "type": "number" },
    "activities": {
      "type": "array",
      "items": { "$ref": "activity.json" }
    },
    "federalCitations": { "$ref": "federalCitations.json" },
    "incentivePayments": { "$ref": "incentivePayments.json" },
    "keyPersonnel": { "$ref": "keyPersonnel.json" },
    "narrativeHIE": { "type": "string" },
    "narrativeHIT": { "type": "string" },
    "narrativeMMIS": { "type": "string" },
    "previousActivityExpenses": { "$ref": "previousActivityExpenses.json" },
    "previousActivitySummary": { "type": "string" },
    "programOverview": { "type": "string" },
    "stateProfile": { "$ref": "stateProfile.json" },
    "years": {
      "type": "array",
      "items": { "type": "string" }
    }
  },
  "additionalProperties": false
}
