{
  "name": "MN-1936-08-03-HITECH-APD",
  "activities": [],
  "federalCitations": {},
  "incentivePayments": {
    "ehAmt": {},
    "ehCt": {},
    "epAmt": {},
    "epCt": {}
  },
  "keyPersonnel": [],
  "narrativeHIE": "",
  "narrativeHIT": "",
  "narrativeMMIS": "",
  "previousActivityExpenses": {},
  "previousActivitySummary": "",
  "programOverview": "",
  "stateProfile": {
    "medicaidDirector": { "name": "", "email": "", "phone": "" },
    "medicaidOffice": {
      "address1": "",
      "address2": "",
      "city": "",
      "state": "",
      "zip": ""
    }
  },
  "years": []
}
