{
  "name": "AZ-1865-12-06-HITECH-APD",
  "activities": [
    {
      "id": 4110,
      "alternatives": "",
      "contractorResources": [
        {
          "description": "",
          "end": "",
          "hourly": {
            "data": {
              "2019": {
                "hours": "",
                "rate": ""
              },
              "2020": {
                "hours": "",
                "rate": ""
              }
            },
            "useHourly": false
          },
          "hourlyData": [],
          "id": 9900,
          "name": "",
          "start": "",
          "totalCost": 0,
          "years": {
            "1865": 0,
            "1866": 0
          }
        }
      ],
      "costAllocation": {},
      "costAllocationNarrative": {
        "methodology": "",
        "2019": {
          "otherSources": "none"
        },
        "2020": {
          "otherSources": "none"
        }
      },
      "description": "",
      "expenses": [],
      "fundingSource": false,
      "name": "",
      "objectives": [],
      "plannedEndDate": "",
      "plannedStartDate": "",
      "schedule": [],
      "standardsAndConditions": {
        "doesNotSupport": "",
        "supports": ""
      },
      "statePersonnel": [],
      "summary": "",
      "quarterlyFFP": {}
    }
  ],
  "federalCitations": {},
  "incentivePayments": {
    "ehAmt": {},
    "ehCt": {},
    "epAmt": {},
    "epCt": {}
  },
  "keyPersonnel": [],
  "narrativeHIE": "",
  "narrativeHIT": "",
  "narrativeMMIS": "",
  "previousActivityExpenses": {},
  "previousActivitySummary": "",
  "programOverview": "",
  "stateProfile": {
    "medicaidDirector": { "name": "", "email": "", "phone": "" },
    "medicaidOffice": {
      "address1": "",
      "address2": "",
      "city": "",
      "state": "",
      "zip": ""
    }
  },
  "years": []
}
